FID,MAP,REFNAME,PARKNAME,LOCATION,OBSERVER,FIELDDATE,APPROVDATE,MANAGER,CS,PS,PS_HIGH,PS_LOW,CU,CU_ACTUAL,PU,PU_HIGH,PU_LOW,TH_RANK_CS,TH_RANK_PS,PROB_FLAG,TRL_ENTPT,TRL_SIGN,PARKING,PKG_AUTO,PKG_BUS,PKG_HORSE,PKG_HANDIC,PKG_TYPE,PKG_SUBSTR,RESTROOM,RSTRM_TYPE,RANGER_STA,INFO_KIOSK,WAY_EXH,WATER,PHONE,GARBAGE,RECYC_BINS,MUTTMITT,SCEN_OVRLK,PICNIC,CAMP_REG,CAMP_GRP,CAMP_BCK,COMMENTS,COASTALZN,LVMCOG_TH,lat,lng,SMMTC_TH,DOGS,COUNTY,JURISDN
391,81,Topanga / Alta Dr / Corsham Rd,,Corsham Road,Jessica/Jill,4/4/2003,mb12/07/03 entered by NK 09/03/0,OTH-PRIVATE,DL,DL,DL,DL,,,,,,NA,NA,,No,No,No,0,0,0,0,NA,NA,No,NA,No,No,No,No,XX,XX,XX,XX,No,No,No,No,No,,Outside,0,34.1218923,-118.6084563,0,,LOS ANGELES,Unincorp LA
392,77,Summit to Summit Mtwy,,Summit to Summit Motorway,Jessica/Jill,3/19/2003,mb12/07/03 entered by NK 09/03/0,OTH-PRIVATE,DL,DL,DL,DL,,,,,,NA,NA,,No,No,No,0,0,0,0,NA,NA,No,NA,No,No,No,No,XX,XX,XX,XX,No,No,No,No,No,,Outside,0,34.12236858,-118.6164797,0,,LOS ANGELES,Unincorp LA
393,93,Pinnacle Pl,Fryman adjacent,gated community off Mulholland Dr ^ Summit Circle,MB/EE,6/21/2000,mb10/31/00,PRIVATE,UP,UP,UP,UP,,,,,,Unauthorized,Unauthorized,Yes,Yes,No,No,0,0,0,0,NA,NA,No,NA,No,No,No,No,No,XX,XX,XX,No,No,No,No,No,"parkland entrance from a gated community.  ignore, close, SUP?",Outside,0,34.12523197,-118.3975726,0,,LOS ANGELES,Los Angeles
394,93,Fryman Canyon -- Briarcliff Lane West,Fryman Canyon Park,Briarcliff,Kerry/Andrew,3/14/2000,mb06/20/00,NPS,UP,UP,UP,UP,,,,,,Unauthorized,Unauthorized,Yes,Yes,No,Yes,4,0,0,0,on-street,paved,No,NA,No,No,No,No,XX,XX,XX,XX,No,No,No,No,No,"Access will be nil when private gate is closed.  Neighborhood entrance.  ignore, close, SUP?",Outside,0,34.12545162,-118.3858601,0,,LOS ANGELES,Los Angeles
395,77,Summit to Summit Mtwy,,Summit to Summit Motorway,Jessica/Jill,3/19/2003,mb12/07/03 entered by NK 09/03/0,OTH-PRIVATE,DL,DL,DL,DL,,,,,,NA,NA,,No,No,No,0,0,0,0,NA,NA,No,NA,No,No,No,No,XX,XX,XX,XX,No,No,No,No,No,,Outside,0,34.12265978,-118.6203849,0,,LOS ANGELES,Unincorp LA
396,93,Fryman Canyon -- Valleycrest Rd.,Fryman Canyon Park,Valley Crest Road,Andrew,3/17/2000,mb11/01/00,Private,DL,DL,DL,DL,,,,,,NA,NA,,Yes,No,No,0,0,0,0,NA,NA,No,NA,No,No,No,No,XX,XX,XX,XX,No,No,No,No,No,"10 is same situation as 8, 9.  There might be access through a street to the north.  mb edits.",Outside,0,34.12585996,-118.3884282,0,,LOS ANGELES,Los Angeles
397,81,Topanga/Alta Dr,,Alta Dr & Altaridge Drive,Jessica/Jill,4/4/2003,mb12/07/03 entered by NK 09/03/0,OTH-PRIVATE,UX,UX,UX,UX,,,,,,NA,NA,,Maybe,No,No,0,0,0,0,NA,NA,No,NA,No,No,No,No,XX,XX,XX,XX,No,No,No,No,No,,Outside,0,34.12327217,-118.6060296,0,,LOS ANGELES,Unincorp LA
398,82,Calabasas Peak Mtwy,,Calabasas Peak Motorway,Jessica/Jill,3/19/2003,entered by NK 09/03/03,,DL,DL,DL,DL,,,,,,NA,NA,,No,No,No,0,0,0,0,NA,NA,No,NA,No,No,No,No,XX,XX,XX,XX,No,No,No,No,No,,Outside,0,34.12277685,-118.6478438,0,,LOS ANGELES,Unincorp LA
399,77,Summit to Summit Mtwy,,Summit to Summit Motorway,Jessica/Jill,3/19/2003,mb12/07/03 entered by NK 09/03/0,OTH-PRIVATE,DL,DL,DL,DL,,,,,,NA,NA,,No,No,No,0,0,0,0,NA,NA,No,NA,No,No,No,No,XX,XX,XX,XX,No,No,No,No,No,,Outside,0,34.12326296,-118.615155,0,,LOS ANGELES,Unincorp LA
400,77,Summit-to-Summit Mtwy/Janes Tr,,Summit to Summit Motorway,Jessica/Jill,3/19/2003,mb12/07/03 entered by NK 09/03/0,OTH-PRIVATE,DL,DL,DL,DL,,,,,,NA,NA,,No,No,No,0,0,0,0,NA,NA,No,NA,No,No,No,No,XX,XX,XX,XX,No,No,No,No,No,,Outside,0,34.1231949,-118.622542,0,,LOS ANGELES,Unincorp LA
401,77,Summit to Summit Mtwy,,Summit to Summit Motorway,Jessica/Jill,3/19/2003,mb12/07/03 entered by NK 09/03/0,OTH-PRIVATE,DL,DL,DL,DL,,,,,,NA,NA,,No,No,No,0,0,0,0,NA,NA,No,NA,No,No,No,No,XX,XX,XX,XX,No,No,No,No,No,,Outside,0,34.12325792,-118.6211835,0,,LOS ANGELES,Unincorp LA
402,80,Santa Maria Road,Summit Valley Edmund D. Edelman Park,Santa Maria Road,MB - in office,5/28/2001,mb01/02/04 mb05/28/01,private,OP,OP,OP,OP,MU,,,,,Tertiary,Tertiary,,Yes,Maybe,Yes,1,0,0,0,pullout,dirt,No,NA,No,No,No,No,No,XX,XX,XX,No,No,No,No,No,"MB-info filled out in-house.  No easy, legitimate parking, but serves as xing over Santa Maria Cyn Rd.",Outside,0,34.12384172,-118.5880727,0,Y,LOS ANGELES,Unincorp LA
403,93,Fryman Canyon -- Briarcliff Lane East,Fryman Canyon Park,Briarcliff,Kerry/Andrew,3/14/2000,mb06/20/00,NPS,UP,UP,UP,UP,,,,,,Unauthorized,Unauthorized,Yes,Yes,No,Yes,888,888,888,888,on-street,paved,No,NA,No,No,No,No,XX,XX,XX,XX,No,No,No,No,No,"Access will be nil when private gate is closed.  Neighborhood entrance.  ignore, close, SUP?",Outside,0,34.12666134,-118.38234,0,,LOS ANGELES,Los Angeles
404,77,Summit-to-Summit Mtwy,,Summit to Summit ^ Marquette Connector Trail,Jessica/Jill,3/19/2003,mb12/07/03 entered by NK 09/03/0,OTH-PRIVATE,DL,DL,DL,DL,,,,,,NA,NA,,No,No,No,0,0,0,0,NA,NA,No,NA,No,No,No,No,XX,XX,XX,XX,No,No,No,No,No,,Outside,0,34.124259,-118.624244,0,,LOS ANGELES,Unincorp LA
405,77,Adamsville Av / Summit to Summit Mtwy,,Adamsville Av / Summit to Summit Mtwy,Ralf,,mb12/07/03 entered by NK,OTH-PRIVATE,DL,DL,DL,DL,,,,,,NA,NA,,No,No,No,0,0,0,0,NA,NA,No,NA,No,No,No,No,XX,XX,XX,XX,No,No,No,No,No,,Outside,0,34.12482727,-118.6127698,0,,LOS ANGELES,Unincorp LA
406,71,Dirt Mulholland Dr ^ Garapito Trail,Topanga State Park,Dirt Mulholland Dr ^ Garapito Trail,MB/EE,6/27/2000,mb10/31/00,CDPR,DL,DL,DL,DL,,,,,,NA,NA,,Yes,Yes,Yes,888,888,888,888,on-street,dirt,No,NA,No,No,No,No,No,XX,XX,XX,No,No,No,No,XX,regulatory signage,out,0,34.12588101,-118.5482066,0,,LOS ANGELES,Los Angeles
407,76,Old Topanga ^ Calabasas Motorway,,Old Topanga ^ Calabasas Motorway,Jessica/Jill,3/19/2003,mb01/02/04 entered by NK 09/03/0,,DL,DL,DL,DL,NA,NA,NA,,,NA,NA,,No,No,Yes,0,0,0,0,on-street,dirt,No,NA,No,No,No,No,XX,XX,XX,XX,No,No,No,No,No,Trail designation signs don't look official.  Appears to be private equestrian trail.  Old utility & fire road access.  mb edits:  This is a major unofficial entrance to trail network via Cal Mtwy & Summit-to-Summit.  Equestrians enter from nearby equest,Outside,0,34.12493801,-118.6349132,0,,LOS ANGELES,Unincorp LA
408,78,Calabasas Mtwy ^ Old Topanga Cyn Rd,,Calabasas Mtwy ^ Old Topanga Cyn Rd,MB,,mb12/07/03 entered by NK 09/03/0,,UX,EM,EM,EM,MU,MU,MU,,,NA,Tertiary,,Yes,No,Yes,4,0,0,0,pullout,dirt,No,NA,No,No,No,No,XX,XX,XX,XX,No,No,No,No,No,Significant non-park entrance.  Many users.  Friendly access.  Nearby equestrian facility (authorized or not?) provides eq opportunities.,,0,34.12502553,-118.6348938,0,,LOS ANGELES,Unincorp LA
409,77,Summit-to-Summit Mtwy/Marquett,,Summit to Summit Motorway,Jessica/Jill,3/19/2003,mb12/07/03 entered by NK 09/03/0,OTH-PRIVATE,DL,DL,DL,DL,,,,,,NA,NA,,No,No,No,0,0,0,0,NA,NA,No,NA,No,No,No,No,XX,XX,XX,XX,No,No,No,No,No,,Outside,0,34.12524713,-118.6248711,0,,LOS ANGELES,Unincorp LA
410,68,Cornell Rd Access,Paramount Ranch,Cornell Rd ^ 3300 Block,MB,3/4/2003,mb12/30/03 entered by NK 09/03/0,,UP,UP,UP,UP,UN,EQ,NA,,,Unauthorized,Unauthorized,Yes,Yes,No,No,0,0,0,0,NA,NA,No,NA,No,No,No,No,No,No,No,XX,No,No,No,No,No,"Private access.  If maintain as UP instead of EC, should an SUP be required?",,0,34.1236225,-118.7498924,0,,LOS ANGELES,Unincorp LA
411,74,Ed Edelman Park Neighborhood Entrance,Summit Valley Ed Edelman Park,Entrado Rd Neighborhood,,,mb01/02/04,MRCA,UP,UP,UP,UP,,,,,,Unauthorized,Unauthorized,Yes,No,No,No,0,0,0,0,NA,NA,No,NA,No,No,No,No,XX,XX,XX,XX,No,No,No,No,No,"Neighborhood entrance to state parkland.  ignore, close, SUP?",Outside,0,34.12569637,-118.6012584,0,,LOS ANGELES,Unincorp LA
412,74,Ed Edelman Park Neighborhood Entrance,Canyon Oaks,Koontz Way Neighborhood,,,mb01/02/04,MRCA,UP,UP,UP,UP,,,,,,Unauthorized,Unauthorized,,No,No,No,0,0,0,0,NA,NA,No,NA,No,No,No,No,XX,XX,XX,XX,No,No,No,No,No,"Neighborhood entrance to state parkland.  ignore, close, SUP?",Outside,0,34.12568088,-118.6029642,0,,LOS ANGELES,Unincorp LA
413,71,Dirt Mulholland Dr ^ Temescal Cyn Fire Rd,Topanga State Park,Dirt Mulholland Dr ^ Temescal Cyn Fire Rd,MB/EE,6/27/2000,mb10/31/00,CDPR,DL,DL,DL,DL,,,,,,NA,NA,,Yes,Yes,Yes,888,888,888,888,on-street,dirt,No,NA,No,No,No,No,XX,XX,XX,XX,No,No,No,No,No,"SP regulatory signage, but not located at a park entrance.",Outside,0,34.12636819,-118.5564182,0,,LOS ANGELES,Los Angeles
414,120,Iredell Lane Trailhead,B.B.Dearing Trail Easemt/Fryman Cyn Adj,Iredell Ln ^ Lower Fryman Fire Rd,EE/JW,6/29/2000,mb10/31/00,MRCA,OP,OP,OP,OP,HO,HO,,,,Tertiary,Tertiary,,Yes,No,No,0,0,0,0,NA,NA,No,NA,No,No,No,No,No,Yes,No,No,No,No,No,No,No,"10/14/09 MB Visited site over weekend.  Trash can is a private bin marked ""Trail"".  Sign is up trail a ways and only indicates direction to ""Rainforest"".  ""No Parking 7am to 8pm"" signs all up and down street.",out,0,34.12848672,-118.3987482,0,Y,LOS ANGELES,Los Angeles
415,0,Universal City Overlook,Mulholland Scenic Parkway,7701 Mulholland Drive,MB/EE,6/21/2000,mb10/31/00,SMMC/LA city,OP,OP,OP,OP,NA,NA,,,,Overlook Only,Overlook Only,,No,No,Yes,2,0,0,1,pullout,paved,No,NA,No,No,No,No,No,XX,XX,XX,Official,No,No,No,XX,,out,0,34.12909108,-118.3660611,0,,LOS ANGELES,Los Angeles
416,71,Topanga State Park/Fire Rd 28,Topanga State Park,Dirt Mulholland Dr ^ Fire Road 28,MB/EE,6/27/2000,mb10/31/00,CDPR,DL,DL,DL,DL,,,,,,NA,NA,,Yes,Yes,Yes,5,0,0,0,pullout,dirt,No,NA,No,No,No,No,No,XX,XX,XX,No,No,No,No,No,Caballero Cyn Trail to Reseda Blvd,Outside,0,34.12720306,-118.5432113,0,,LOS ANGELES,Los Angeles
417,68,Las Virgenes Municipal Water D,,Las Virgenes Road,MB,,mb12/17/02,,DL,DL,DL,DL,,,,,,NA,NA,,No,No,No,0,0,0,0,NA,NA,No,NA,No,No,No,No,XX,XX,XX,XX,No,No,No,No,No,,Outside,0,34.12509019,-118.7060924,0,,LOS ANGELES,Calabasas
418,120,Iredell Ln at Fire Road,Private Adj to Coldwater Cyn Park,Iredell Ln ^ Fire Road,EE/JW,6/29/2000,mb10/31/00,MRCA,OP,OP,OP,OP,HB,HB,HB,,,Tertiary,Tertiary,,Yes,Yes,No,0,0,0,0,NA,NA,No,NA,No,No,No,No,No,Yes,No,No,No,No,No,No,No,"facilities up trail at Tree People.  SMMC reg signage, LAMC reg signage.  mb12/10/08 - use designation confirmed by MRCA Jewel Johnson  10/14/09 MB - Visited site, confirmed facilities.  ""No Parking 7am to 8pm"" signs all up and down street.",out,0,34.1290697,-118.3992636,0,Y,LOS ANGELES,Los Angeles
419,70,Dirt Mulholland Eastern Entrance,Westridge Canyonback Dirt Mulholland,Dirt Mulholland ^ Canyonback Rd,MB,6/27/2000,mb01/02/04,MRCA,UP,EM,EM,EM,,MU,MU,,,Unauthorized,Secondary,,No,No,Yes,0,0,0,0,on-street,dirt,No,NA,No,No,No,No,XX,XX,XX,XX,No,No,No,No,No,In-hse review from memory.  Major dog walking area.  Can park here when gate to west on dirt Mulholland is closed.,Outside,0,34.1279618,-118.5028064,0,,LOS ANGELES,Los Angeles
420,71,Dirt Mulholland,Topanga State Park,Dirt Mulholland Dr,MB/EE,6/27/2000,mb10/31/00,CDPR,DL,DL,DL,DL,,,,,,NA,NA,,Yes,No,Yes,888,888,888,888,on-street,dirt,No,NA,No,No,No,No,XX,XX,XX,XX,No,No,No,No,No,,Outside,0,34.12753859,-118.5419845,0,,LOS ANGELES,Los Angeles
421,82,Secret Trail Trailhead,unnamed,Mulholland ^ Secret Trail,Jessica/Jill,4/7/2003,mb01/01/04 entered by NK 09/03/0,private,OP,OP,OP,OP,XX,,,,,Tertiary,Tertiary,,Yes,Yes,Yes,5,0,99,0,pullout,dirt,No,NA,No,No,No,No,XX,XX,XX,XX,No,No,No,No,No,"In-hse review from memory.  Need to ck on facilities, if any.",Outside,1,34.12644651,-118.6573442,0,Y,LOS ANGELES,Calabasas
422,120,Coldwater Canyon,Coldwater Cyn/ Wilacre,Coldwater Canyon,EE,6/29/2000,mb10/31/00,LA City,DL,DL,DL,DL,,,,,,NA,NA,,Yes,Yes,Yes,5,0,0,0,pullout,dirt,No,NA,No,No,No,No,No,XX,XX,XX,No,Yes,No,No,XX,can access TreePeople facilities from this entrance; no parking 9pm - 6am; Coldwater Cyn Park signs,out,0,34.12971401,-118.4072911,0,,LOS ANGELES,Los Angeles
423,120,Barker Fire Rd,Coldwater Canyon Park,Barker Fire Rd ^ Coldwater Cyn,EE,6/29/2000,mb10/31/00,LA City,OP,OP,OP,OP,HB,HB,,,,Tertiary,Tertiary,,Yes,Yes,No,0,0,0,0,NA,NA,No,NA,No,No,No,No,No,XX,XX,XX,No,No,No,No,XX,same lot as in pt. 627;  LAMC reg. Sign.; Can access TreePeople facilities from this entrance; Coldwater Cyn Park signs; mb12/1/08 - Lacy Brown at TreePeople confirmed info.,out,0,34.12977477,-118.4074944,0,Y,LOS ANGELES,Los Angeles
424,77,Summit to Summit Motorway,,Summit to Summit Motorway,Jessica/Jill,3/19/2003,entered by NK 09/03/03,,DL,DL,DL,DL,,,,,,NA,NA,,No,No,No,0,0,0,0,NA,NA,No,NA,No,No,No,No,XX,XX,XX,XX,No,No,No,No,No,,Outside,0,34.12705088,-118.6287655,0,,LOS ANGELES,Calabasas
425,120,TreePeople parking lot,Coldwater Canyon Park,Coldwater Cyn Rd ^ TreePeople,EE/JW,6/29/2000,mb01/02/04 mb10/31/00,LA City,OP,OP,OP,OP,HB,HB,,,,Primary,Primary,,Yes,Yes,Yes,50,0,0,3,parking lot,dirt,Yes,flush,No,Yes,Yes,Yes,No,Yes,Yes,XX,No,Yes,No,No,XX,many trails; LAMC & SMMC regulatory signs; S.Mark Taper Amphitheatre; beverage machines; recycling;  mb01/02/04 may be paved (expect semi-permeable?) pkg now?  mb12/1/08 - Lacy Brown at TreePeople confirmed use designation,out,0,34.12981955,-118.4054214,0,Y,LOS ANGELES,Los Angeles
426,81,Edelman Park Trailhead,Summit Valley Edmund D. Edelman Park,Topanga Canyon Blvd ^ Ed Edelman Park,MB,4/4/2003,mb12/11/03 entered by NK 09/03/0,MRCA,OP,OP,OP,OP,MU,,,,,Tertiary,Tertiary,,Yes,Yes,Yes,10,0,0,0,parking lot,dirt,Yes,chemical,No,No,No,No,No,Yes,Proposed,XX,No,No,No,No,No,In-house review.  No point on GIS.  Moved a DL point to this location.,Outside,2,34.12749048,-118.598622,0,Y,LOS ANGELES,Unincorp LA
427,70,Dirt Mulholland Dr ^ Sullivan Fire Rd,Sullivan Cyn,Mulholland ^ Sullivan,MB/EE,6/27/2000,mb10/31/00,LA Co Sanitation,DL,DL,DL,DL,,,,,,NA,NA,,Yes,No,Yes,3,0,0,0,pullout,dirt,No,NA,No,No,No,No,No,XX,XX,XX,No,No,No,No,No,Internal location.,Outside,0,34.1285688,-118.526506,0,,LOS ANGELES,Los Angeles
428,70,Nike Missile Overlook,Westridge-Canyonback Wilderness Park,Dirt Mulholland Dr ^ W Mandeville Fire Rd,MB/EE,6/27/2000,mb10/31/00,MRCA,OP,OP,OP,OP,MU,MU,MU,,,Secondary,Secondary,,Yes,Yes,Yes,3,0,0,2,parking lot,gravel,Yes,flush,No,No,No,Yes,Yes,Yes,Yes,XX,Official,Yes,No,No,No,trash & recycle bins;  beverage machines;  overlook w/ telescope,Outside,2,34.12904772,-118.5133829,0,Y,LOS ANGELES,Los Angeles
429,69,"Wagon Rd, outside of NRA",,Wagon Road neighborhood,MB,,mb01/01/04,,UP,UP,UP,UP,UN,HE,,,,Unauthorized,Unauthorized,,Yes,No,No,0,0,0,0,NA,NA,No,NA,No,No,No,No,XX,XX,XX,XX,No,No,No,No,No,"In-hse review, but this is definitely a neighborhood entrance.  close or require SUP?",Outside,0,34.12597807,-118.7536555,0,,LOS ANGELES,Unincorp LA
430,68,De Anza Park,De Anza Park,Las Virgenes ^ Lost Hills,MB,,mb12/17/02,Calabasas,OP,OP,OP,OP,MU,MU,MU,,,Secondary,Secondary,,Yes,Yes,Yes,40,0,0,2,parking lot,paved,Yes,flush,No,No,No,Yes,Yes,Yes,XX,XX,No,Yes,No,No,No,Combined JZ/JK info from 219.,Outside,1,34.12672716,-118.7076136,0,Y,LOS ANGELES,Calabasas
431,0,Paramount North - Old Oak Rd,,Paramount North - Old Oak Rd,MB,,mb01/01/04,NPS,UP,UP,UP,UP,UN,HE,UN,,,Unauthorized,Unauthorized,Yes,Yes,No,No,0,0,0,0,NA,NA,No,NA,No,No,No,No,XX,XX,XX,XX,No,No,No,No,No,Access used by gated community.  Should require SUP or close access?,out,0,34.12621663,-118.7521565,0,,LOS ANGELES,Unincorp LA
432,69,Paramount North,,Paramount North,MB,,mb12/31/03 mb12/17/02,NPS,UP,UP,UP,UP,UN,HE,UN,,,Unauthorized,Unauthorized,,Yes,No,Yes,1,0,0,0,pullout,dirt,No,NA,No,No,No,No,XX,XX,XX,XX,No,No,No,No,No,"In-hse review.  Mostly neighbors entering, but general public could park & enter.",Outside,0,34.12631099,-118.751327,0,,LOS ANGELES,Unincorp LA
433,70,Dirt Mulholland ^ Farmer Ridge Fire Rd,Topanga State Park,Dirt Mulholland ^ Farmer Ridge Fire Rd,MB/EE,6/27/2000,mb10/31/00,CDPR,DL,DL,DL,DL,,,,,,NA,NA,,Yes,No,Yes,10,0,0,0,pullout,dirt,No,NA,No,No,No,No,No,XX,XX,XX,No,No,No,No,XX,Internal location.,out,0,34.12945392,-118.5306693,0,,LOS ANGELES,Los Angeles
434,76,Tan Pan Trail,,Dorothy Rd / Tan Pan Terrace,Jessica/Jill,3/19/2003,mb01/02/04 entered by NK 09/03/0,,UX,UX,UX,UX,,,,,,NA,NA,,No,No,No,0,0,0,0,NA,NA,No,NA,No,No,No,No,XX,XX,XX,XX,No,No,No,No,No,Private access,Outside,0,34.12857435,-118.6355864,0,,LOS ANGELES,Calabasas
435,69,Kanan Rd adjacent ^ Paramount NW corner,,Kanan Rd adjacent ^ Paramount NW corner,MB,,mb12/30/03,,UP,UP,UP,UP,UN,EQ,UN,,,Unauthorized,Unauthorized,Yes,Yes,No,No,0,0,0,0,NA,NA,No,NA,No,No,No,No,XX,XX,XX,XX,No,No,No,No,No,"12/30/03 - In-house review.  Park entrance point is where illegally built trail intersects NPS boundary in NW wing of Paramount Ranch.  Used primarily by equestrians, likely coming from Triunfo Cyn ranches.",Outside,0,34.12677192,-118.7681777,0,,LOS ANGELES,Unincorp LA
436,75,Adamsville Ave South,,Adamsville Avenue Terminus,MB - in office,5/28/2001,mb01/02/04 mb05/28/01,private,UX,UX,UX,UX,,MU,,,,NA,NA,,Yes,No,Yes,1,0,0,0,pullout,dirt,No,NA,No,No,No,No,XX,XX,XX,XX,No,No,No,No,No,"Moved pt along road farther to south.  Probably will always be UX, although parking may become off-limits if developed.",Outside,0,34.12914204,-118.6149371,0,,LOS ANGELES,Calabasas
437,74,Summit Valley Ed Edelman Park,Summit Valley Ed Edelman Park,Topanga Canyon Boulevard,,,mb01/02/04,MRCA,DL,DL,DL,DL,,,,,,NA,NA,,No,No,No,0,0,0,0,NA,NA,No,NA,No,No,No,No,XX,XX,XX,XX,No,No,No,No,No,,Outside,0,34.12936527,-118.5995006,0,,LOS ANGELES,Unincorp LA
438,68,Malibu Creek State Pk/Liberty Cyn,Malibu Creek State Park,Liberty Canyon Rd ^ Liberty Cyn Fire Rd,MB,,mb12/17/02,CDPR,OP,OP,OP,OP,MU,,,,,Tertiary,Tertiary,Yes,Yes,Yes,Yes,888,0,777,0,on-street,paved,No,NA,No,No,No,No,No,No,No,No,No,No,No,No,No,"In-house review.  DPR allows unofficial access? MB 07/10/07 - Agoura Hills staff checked, and it is okay to categorize TH as OP, although entrance is tertiary neighborhood entrance.  Changed status from UP to OP.",Outside,1,34.12770573,-118.7239441,0,N,LOS ANGELES,Agoura Hills
439,68,Juan Bautista de Anza Park,Malibu Creek SP,"Lost Hills Road, Juan Bautista de Anza Park",Jessica/Jill,3/4/2003,mb01/01/04 entered by NK 09/03/0,City of Calabasas,DL,DL,DL,DL,,,,,,NA,NA,,Yes,No,Yes,40,0,0,2,parking lot,paved,Yes,XX,No,No,No,Yes,Yes,XX,XX,XX,No,Yes,No,No,No,"Chumash info sign.  ""Unsupervised trail"" but formal trailhead.  mb --??-- re-ck in field.  must be same facilities as 217",Outside,0,34.12797552,-118.708216,0,,LOS ANGELES,Calabasas
440,76,Calabasas Highlands Entrance,,Terminus Fern Trail (a road),Jessica/Jill,3/19/2003,mb01/01/04 entered by NK 09/03/0,,UP,UP,UP,UP,,,,,,Unauthorized,Unauthorized,,No,No,No,0,0,0,0,NA,NA,No,NA,No,No,No,No,XX,XX,XX,XX,No,No,No,No,No,Calabasas Highlands neighborhood entrance to Calabasas Motorway.  City of Cal would like to make an official trailhead on Mulholland.,Outside,0,34.12904943,-118.6481044,0,,LOS ANGELES,Unincorp LA
441,119,Deep Canyon Overlook,Mulholland Scenic Parkway,13801 Mulholland Drive,,,,MRCA,OP,OP,OP,OP,NA,,,,,Overlook Only,Overlook Only,,No,No,Yes,888,0,0,0,pullout,paved,No,NA,No,Yes,No,No,No,No,No,No,Official,No,No,No,No,10/14/09 MB - Info from Bing maps.,out,0,34.13174569,-118.4334241,0,,LOS ANGELES,Los Angeles
442,95,Stone Canyon Overlook,Mulholland Scenic Parkway,13931 Mulholland Drive,,,,MRCA,OP,OP,OP,OP,DA,,,,,Overlook Only,Overlook Only,,Yes,No,Yes,8,0,0,1,parking lot,paved,No,NA,No,No,Yes,No,No,Maybe,Maybe,No,Official,No,No,No,No,10/14/09 MB - Added Overlook and assessed facil's using Bing Maps.  Short ADA trail.,Outside,0,34.13164145,-118.4491542,0,,LOS ANGELES,Los Angeles
443,71,Top of Reseda,Marvin Braude Mulholland Gateway Park,Dirt Mulholland Dr ^ Reseda Blvd,MB/EE,6/27/2000,mb10/31/00,MRCA,OP,OP,OP,OP,MU,MU,MU,,,Secondary,Secondary,,Yes,Yes,Yes,20,0,0,0,on-street,paved,Yes,portable,No,Yes,No,Yes,No,Yes,Proposed,Proposed,No,Yes,No,No,No,,Outside,2,34.13056297,-118.5529499,0,Y,LOS ANGELES,Los Angeles
444,81,The Groves Overlook,Mulholland Scenic Parkway,16501 Mulholland Drive,,,,MRCA,OP,OP,OP,OP,NA,,,,,Overlook Only,Overlook Only,,No,No,No,888,0,0,888,pullout,dirt,No,NA,No,No,No,No,No,Maybe,No,No,Official,No,No,No,No,10/14/09 MB Added point from LAMountains.com and used Bing Maps for facilities.  Needs field check.,Outside,0,34.13148022,-118.4911633,0,,LOS ANGELES,Los Angeles
445,70,Topanga SP -- Mulholland Dr/Fire Rd 28,Mulholland Gateway,Mulholland Highway,MB/EE,6/27/2000,mb10/31/00,CDPR,DL,DL,DL,DL,,,,,,NA,NA,,No,No,No,0,0,0,0,NA,NA,No,NA,No,No,No,No,XX,XX,XX,XX,No,No,No,No,No,,Outside,0,34.13100757,-118.5328261,0,,LOS ANGELES,Los Angeles
446,68,Lost Hills Rd & Calabasas Hill,,Lost Hills Road,MB,,mb12/17/02,,DL,DL,DL,DL,,,,,,NA,NA,,No,No,No,0,0,0,0,NA,NA,No,NA,No,No,No,No,XX,XX,XX,XX,No,No,No,No,No,In-house review,Outside,0,34.12869998,-118.708481,0,,LOS ANGELES,Calabasas
447,70,Johnson Overlook,Mulholland Scenic Parkway,14801 Mulholland Drive,,,,Other - City of LA,OP,OP,OP,OP,NA,,,,,Overlook Only,Overlook Only,,No,No,Yes,888,0,0,0,pullout,dirt,No,NA,No,No,No,No,No,No,No,No,Official,No,No,No,No,10/14/09 MB Added point and facilities using Bing Maps.,Outside,0,34.1321887,-118.457303,0,,LOS ANGELES,Los Angeles
448,56,Lake Sherwood/Carlisle Rd,,Carlisle Road,Jessica/Jill,4/7/2003,entered by NK  09/10/03,,DL,DL,DL,DL,,,,,,NA,NA,,No,No,No,0,0,0,0,NA,NA,No,NA,No,No,No,No,XX,XX,XX,XX,No,No,No,No,No,,Outside,0,34.12668826,-118.8692266,0,,VENTURA,Unincorp Ventura
449,68,Calabasas Hills Rd & Lost Springs,,Calabasas Hills Road,MB,,mb12/17/02,City of Calabasas,UP,EC,EC,EC,,,,,,Unauthorized,NA,,Yes,No,No,0,0,0,0,NA,NA,No,NA,No,No,No,No,XX,XX,XX,XX,No,No,No,No,No,In-house review.  DPR should work w/City to close park entrance.,Outside,0,34.12908255,-118.7091773,0,,LOS ANGELES,Calabasas
450,120,Wilacre Park Main Entrance,Wilacre Park,Wilacre Park ^ Laurel Cyn Bl,EE/JW,6/29/2000,mb01/02/04 mb10/31/00,MRCA,OP,OP,OP,OP,HB,HB,,,,Secondary,Secondary,,Yes,Yes,Yes,70,0,0,1,parking lot,paved,Yes,portable,No,No,No,Yes,No,Yes,Yes,Yes,No,No,No,No,No,"Ranger residence - Kevin Perrine  10/14/09 MB  Visited site 10/9/09.  Facilities are updated.  No muttmitt dispenser, just bags made available in wooden box.  water is a drinking fountain.",out,2,34.1332342,-118.3918209,0,Y,LOS ANGELES,Los Angeles
451,68,Abrams Trailhead,Abrams Property,Agoura Rd,MB,,mb,MRCA,OP,OP,OP,OP,MU,,,,,NA,NA,,No,No,No,0,0,0,0,NA,NA,No,NA,No,No,No,No,XX,XX,XX,XX,No,No,No,No,No,mb notes Luis to field check and correctly populate this record. 12/22/2011,Outside,0,34.13702052,-118.7288714,0,,LOS ANGELES,Calabasas
452,119,Barbara Asa Dorain Trail,Dixie Canyon,Dixie Cyn Pl ^ Barbara Asa Dorain Trail,EE,6/29/2000,mb10/31/00,MRCA,OP,OP,OP,OP,HO,,,,,Tertiary,Tertiary,,Yes,Yes,Yes,6,0,0,0,on-street,paved,No,NA,No,No,No,No,No,Yes,XX,XX,No,No,No,No,XX,stairs at end of st. lead to trail; SMMC reg and trail name signs; trail follows creek; trash bin,out,0,34.13464302,-118.4232642,0,Y,LOS ANGELES,Los Angeles
453,74,Viewridge Trailhead,Summit Valley Edmund D Edelman Park,Viewridge Rd Terminus,Jessica/Jill,3/19/2003,mb12/07/03 entered by NK 09/03/0,MRCA,OP,OP,OP,OP,HE,HE,HE,,,Tertiary,Tertiary,,Yes,Yes,Yes,10,0,0,0,on-street,paved,No,NA,No,Yes,No,No,XX,XX,XX,XX,No,No,No,No,No,Parks partnership property,Outside,2,34.13285214,-118.5912458,0,Y,LOS ANGELES,Unincorp LA
454,119,South end of Newcomb Dr,Dixie Cyn,Newcomb Dr ^ Dixie Cyn Pl,EE,6/29/2000,mb01/02/04 mb10/31/00,private,UP,UP,UP,UP,,,,,,Unauthorized,Unauthorized,,No,No,Yes,2,0,0,0,on-street,paved,No,NA,No,No,No,No,No,XX,XX,XX,No,No,No,No,XX,street sign was lying on ground near beginning of unpaved section; Newcomb Dr from the North dead ends,out,0,34.13499512,-118.4233667,0,,LOS ANGELES,Los Angeles
455,75,"Adamsville Ave North, private park",,Adamsville Avenue,Jessica/Jill,3/19/2003,mb12/07/03 entered by NK 09/03/0,OTH-PRIVATE,UX,UX,UX,UX,,,,,,NA,NA,,No,No,No,0,0,0,0,NA,NA,No,NA,No,No,No,No,XX,Yes,XX,XX,No,Yes,No,No,No,"mb edits - appears to be social trail leading toward Summit-to-Summit.  May eventually be UP that may require closure or SUP, if Wagon Wheel Ranch area is acquired.",Outside,0,34.13331241,-118.6194724,0,,LOS ANGELES,Calabasas
456,72,Dirt Mulholland near helipad,Mulholland Gateway Park,Dirt Mulholland Dr - east/north side,MB/EE,6/27/2000,mb10/31/00,SMMC,DL,DL,DL,DL,,,,,,NA,NA,,Yes,Yes,Yes,888,888,888,888,on-street,dirt,No,NA,No,No,No,No,No,XX,XX,XX,No,No,No,No,No,SMMC regulatory signage.  Still inward away from any parking or walk-in point.,Outside,0,34.1342612,-118.565253,0,,LOS ANGELES,Los Angeles
457,72,Vanalden Ave S terminus,Marvin Braude Mulholland Gateway Park,Vanalden Ave,EE,6/29/2000,mb10/31/00,MRCA,OP,OP,OP,OP,MU,MU,MU,,,Tertiary,Tertiary,Yes,Y,Y,Yes,20,0,0,0,on-street,paved,No,NA,No,No,No,No,No,XX,XX,XX,No,No,No,No,No,"SMMC regulatory signage, no parking 9pm to 6 am, park closed sunset to sunrise.  10/7/09 MB MRCA Ranger Jewel Johnson says this TH has problems with partying.",Outside,0,34.13457642,-118.563061,0,Y,LOS ANGELES,Los Angeles
458,120,end of Shady Oak Rd,Wilacre Park,Shady Oak Rd ^ fire turnout,EE/JW,6/29/2000,mb10/31/00,SMMC,OP,OP,OP,OP,HO,,,,,Tertiary,Tertiary,,Yes,Yes,Yes,888,888,0,888,on-street,paved,No,NA,No,No,No,No,No,XX,XX,XX,No,No,No,No,XX,"SMMC reg. Sign, no parking posted/ don't block fire turnout, park in surrounding neighborhood where legal.",out,0,34.1365482,-118.3999939,0,Y,LOS ANGELES,Los Angeles
459,119,North end of dirt Dixie Cyn Ave,NA,Dixie Cyn Ave,EE,6/29/2000,mb10/31/00,private,UX,UX,UX,UX,,,,,,NA,NA,,Maybe,No,No,0,0,0,0,NA,NA,No,NA,No,No,No,No,No,XX,XX,XX,No,No,No,No,XX,dirt Dixie Cyn Ave is gated and was closed; probably used much by neighbors,out,0,34.13633758,-118.4254774,0,,LOS ANGELES,Los Angeles
460,57,Pentachaeta Trail Trailhead,MRCA property,S end of Lindero Canyon Rd.,MB,,mb01/01/04 mb12/11/03,MRCA,OP,OP,OP,OP,MU,MU,MU,,,Tertiary,Secondary,,Yes,Yes,Yes,5,999,99,999,on-street,paved,Proposed,flush,No,Yes,Yes,No,No,Yes,Proposed,XX,No,No,No,No,No,"In-house review.  Moved a DL point to add this TH to database.  TMP Team:  Develop as a more primary trailhead if missing link connections over to Paramount/Zuma, etc., are accomplished.",out,1,34.13116006,-118.8214361,0,Y,LOS ANGELES,Westlake Village
