FID,MAP,REFNAME,PARKNAME,LOCATION,OBSERVER,FIELDDATE,APPROVDATE,MANAGER,CS,PS,PS_HIGH,PS_LOW,CU,CU_ACTUAL,PU,PU_HIGH,PU_LOW,TH_RANK_CS,TH_RANK_PS,PROB_FLAG,TRL_ENTPT,TRL_SIGN,PARKING,PKG_AUTO,PKG_BUS,PKG_HORSE,PKG_HANDIC,PKG_TYPE,PKG_SUBSTR,RESTROOM,RSTRM_TYPE,RANGER_STA,INFO_KIOSK,WAY_EXH,WATER,PHONE,GARBAGE,RECYC_BINS,MUTTMITT,SCEN_OVRLK,PICNIC,CAMP_REG,CAMP_GRP,CAMP_BCK,COMMENTS,COASTALZN,LVMCOG_TH,lat,lng,SMMTC_TH,DOGS,COUNTY,JURISDN
312,92,Runyon Cyn Astral Dr,Runyon Canyon Park,Astral Drive,Andrew,3/14/2000,mb06/09/00,,DL,DL,DL,DL,,,,,,NA,NA,,No,No,No,0,0,0,0,NA,NA,No,NA,No,No,No,No,XX,XX,XX,XX,No,No,No,No,No,nothing here,Outside,0,34.11463681,-118.3564142,0,,LOS ANGELES,Los Angeles
313,55,Yerba Buena Rd/AT&T Property,,Yerba Buena Rd/AT&T Property,Jessica/Jill,3/17/2003,mb12/31/03 entered by NK  09/10/,,UP,EC,EC,EC,,,,,,Unauthorized,NA,,Yes,No,No,0,0,0,0,NA,NA,No,NA,No,No,No,No,XX,XX,XX,XX,No,No,No,No,No,,Outside,0,34.10737568,-118.9092741,0,,VENTURA,Unincorp Ventura
314,67,Malibu Ck St Pk/Mulholland Hwy,Malibu State Park,Mulholland ^ April Rd,MB,1/29/2003,mb01/29/03,CDPR,AD,AD,AD,AD,,,,,,NA,NA,,No,No,No,0,0,0,0,NA,NA,No,NA,No,No,No,No,XX,XX,XX,XX,No,No,No,No,No,Input from MCSP staff.,Outside,0,34.11035798,-118.7401643,0,,LOS ANGELES,Unincorp LA
315,83,Stokes Cyn Rd,,Stokes Canyon Road,Jessica/Jill,4/7/2003,entered by NK 09/03/03,,UX,UX,UX,UX,,,,,,NA,NA,,Yes,No,No,0,0,0,0,NA,NA,No,NA,No,No,No,No,XX,XX,XX,XX,No,No,No,No,No,,Outside,0,34.11103882,-118.6930647,0,,LOS ANGELES,Unincorp LA
316,81,Will Geer Rd/Mesa Dr,,Will Greer Road (Mesa Drive),MB,,mb11/01/00,OTH-PRIVATE,DL,DL,DL,DL,,,,,,NA,NA,,No,No,No,0,0,0,0,NA,NA,No,NA,No,No,No,No,XX,XX,XX,XX,No,No,No,No,No,,Outside,0,34.11232875,-118.5998653,0,,LOS ANGELES,Unincorp LA
317,111,Malibu Ck St Pk/White Oak Farm,Malibu Creek State Park,Las Virgenes ^ White Oak Farm,MB,1/29/2003,mb01/29/03,CDPR,AD,AD,AD,AD,,,,,,NA,NA,,Yes,Maybe,No,0,0,0,0,NA,NA,No,NA,No,No,No,No,XX,XX,XX,XX,No,No,No,No,No,Input from MCSP staff.,Outside,0,34.1108756,-118.7113482,0,,LOS ANGELES,Unincorp LA
318,81,Will Geer Rd/Mesa Dr,,Will Greer Road (Mesa Drive),MB,,mb11/01/00,OTH-PRIVATE,DL,DL,DL,DL,,,,,,NA,NA,,No,No,No,0,0,0,0,NA,NA,No,NA,No,No,No,No,XX,XX,XX,XX,No,No,No,No,No,,Outside,0,34.11259086,-118.5994731,0,,LOS ANGELES,Unincorp LA
319,92,Runyon Cyn Solar Dr,Runyon Canyon Park,Solar Drive,AP/MB/EE,6/21/2000,mb11/01/00,CTY-LA,UP,UP,UP,UP,,,,,,Unauthorized,Unauthorized,,Yes,No,Yes,1,0,0,0,on-street,paved,No,NA,No,No,No,No,XX,XX,XX,XX,No,No,No,No,No,"connects, eventually into private close to Wattles Garden Park, but not in parkland technically.  No trail map available.  Not posted as no trespassing.",Outside,0,34.11574745,-118.3536261,0,,LOS ANGELES,Los Angeles
320,81,Luse Tank Rd,,Luse Tank Road,Jessica/Jill,4/4/2003,mb12/07/03 entered by NK 09/03/0,OTH-PRIVATE,DL,DL,DL,DL,,,,,,NA,NA,,No,No,No,0,0,0,0,NA,NA,No,NA,No,No,No,No,XX,XX,XX,XX,No,No,No,No,No,,Outside,0,34.11287565,-118.6032202,0,,LOS ANGELES,Unincorp LA
321,81,Henry Ridge Mtwy,,Henry Ridge Motorway,Jessica/Jill,4/21/2003,mb12/07/03 entered by NK 09/03/0,OTH-PRIVATE,DL,DL,DL,DL,,,,,,NA,NA,,No,No,No,0,0,0,0,NA,NA,No,NA,No,No,No,No,XX,XX,XX,XX,No,No,No,No,No,,Outside,0,34.11286554,-118.612775,0,,LOS ANGELES,Unincorp LA
322,79,Chamera Lane,,Chamera Lane,Jessica/Jill,4/7/2003,mb12/07/03 entered by NK 09/03/0,OTH-PRIVATE,DL,DL,DL,DL,,,,,,NA,NA,,No,No,No,0,0,0,0,NA,NA,No,NA,No,No,No,No,XX,XX,XX,XX,No,No,No,No,No,,Outside,0,34.11284906,-118.6208769,0,,LOS ANGELES,Unincorp LA
323,92,Hollywood Bowl Overlook,Mulholland Scenic Parkway,7036 Mulholland Drive,Andrew/MB,3/15/2000,mb06/09/00,MRCA,OP,OP,OP,OP,HO,HO,,,,Overlook Only,Overlook Only,,No,No,Yes,10,0,0,0,parking lot,paved,No,NA,No,No,Yes,Yes,XX,XX,XX,XX,Official,No,No,No,No,,Outside,0,34.11636753,-118.3423213,0,N,LOS ANGELES,Los Angeles
324,67,Mulholland ^ Medea Creek,Malibu Creek State Park,Mulholland ^ Medea Creek,MB,,mb01/01/04 mb12/17/02,NPS,UP,UP,UP,UP,UN,HE,UN,,,Unauthorized,Unauthorized,,Yes,No,No,0,0,0,0,NA,NA,No,NA,No,No,No,No,XX,XX,XX,XX,No,No,No,No,No,In-house review.  Major unauthorized entrance for Malibou Lake community.  close or require SUP?,Outside,0,34.11130523,-118.7556445,0,,LOS ANGELES,Unincorp LA
325,83,Stokes Cyn Rd,,Stokes Canyon Road,Jessica/Jill,4/7/2003,entered by NK 09/03/03,,UX,UX,UX,UX,,,,,,NA,NA,,Yes,No,No,0,0,0,0,NA,NA,No,NA,No,No,No,No,XX,XX,XX,XX,No,No,No,No,No,,Outside,0,34.11232768,-118.6870485,0,,LOS ANGELES,Unincorp LA
326,0,Lake & Franklin Cyn fork,Franklin Canyon,Lake Dr ^ Franklin Cyn Dr,MB/EE,6/21/2000,mb10/31/00,MRCA,OP,OP,OP,OP,HO,HO,,,,Tertiary,Tertiary,,Yes,No,Yes,4,0,0,0,pullout,dirt,No,NA,No,Yes,No,No,No,XX,XX,XX,No,No,No,No,XX,,out,0,34.11598743,-118.413771,0,Y,LOS ANGELES,Los Angeles
327,81,Greenleaf Cyn Rd,,Greenleaf Canyon Road,Jessica/Jill,4/4/2003,mb12/07/03 entered by NK 09/03/0,OTH-PRIVATE,DL,DL,DL,DL,,,,,,NA,NA,,No,No,No,0,0,0,0,NA,NA,No,NA,No,No,No,No,XX,XX,XX,XX,No,No,No,No,No,,Outside,0,34.1136498,-118.608497,0,,LOS ANGELES,Unincorp LA
328,67,Mulholland Hwy ^ Bridge,Paramount Ranch,Mulholland Hwy ^ Bridge,MB,,mb01/01/04,NPS,UP,UP,UP,UP,HE,HE,HE,,,Unauthorized,Unauthorized,Yes,Yes,No,No,0,0,0,0,NA,NA,No,NA,No,No,No,No,XX,XX,XX,XX,No,No,No,No,No,In-hse review.  Serves Malibou Lake community only.  close or require SUP?,Outside,0,34.11178103,-118.7543878,0,,LOS ANGELES,Unincorp LA
329,54,Circle X Rnch/Yerba Buena Rd,Circle X Ranch,Yerba Buena ^ Gravesite,MB,,mb12/31/03,NPS,UP,EC,EC,EC,,,,,,Unauthorized,NA,,No,No,No,0,0,0,0,pullout,dirt,No,NA,No,No,No,No,XX,XX,XX,XX,No,No,No,No,No,,in,0,34.10931486,-118.9323137,0,,VENTURA,Unincorp Ventura
330,82,Beacontree Ln/Hierro Wy inters,,Beacontree Ln/Hierro Wy inters,Jessica/Jill,4/4/2003,entered by NK 09/03/03,,DL,DL,DL,DL,,,,,,NA,NA,,No,No,No,0,0,0,0,NA,NA,No,NA,No,No,No,No,XX,XX,XX,XX,No,No,No,No,No,development roads,Outside,0,34.11330572,-118.6629398,0,,LOS ANGELES,Unincorp LA
331,78,Zuniga Rd,,Zuniga Road,Jessica/Jill,4/7/2003,entered by NK 09/03/03,,UP,UP,UP,UP,,,,,,Unauthorized,Unauthorized,,Yes,No,No,0,0,0,0,NA,NA,No,NA,No,No,No,No,XX,XX,XX,XX,No,No,No,No,No,mb edits,Outside,0,34.11374238,-118.6369804,0,,LOS ANGELES,Unincorp LA
332,81,Will Geer Rd/Mesa Dr,,Will Geer Road (Mesa Drive),,,mb01/02/04,OTH-PRIVATE,DL,DL,DL,DL,,,,,,NA,NA,,No,No,No,0,0,0,0,NA,NA,No,NA,No,No,No,No,XX,XX,XX,XX,No,No,No,No,No,,Outside,0,34.11444247,-118.5990676,0,,LOS ANGELES,Unincorp LA
333,81,Henry Ridge Mtwy,,Henry Ridge Motorway,Jessica/Jill,4/21/2003,mb12/07/03 entered by NK 09/03/0,OTH-PRIVATE,DL,DL,DL,DL,,,,,,NA,NA,,No,No,No,0,0,0,0,NA,NA,No,NA,No,No,No,No,XX,XX,XX,XX,No,No,No,No,No,,Outside,0,34.114332,-118.6126894,0,,LOS ANGELES,Unincorp LA
334,82,Mulholland Hwy & Lyndon Dr,,Mulholland Hwy & Lyndon Dr,Jessica/Jill,4/4/2003,mb01/02/04 entered by NK 09/03/0,,DL,DL,DL,DL,,,,,,NA,NA,,Yes,No,No,0,0,0,0,NA,NA,No,NA,No,No,No,No,XX,XX,XX,XX,No,No,No,No,No,gated access  mb edits,Outside,0,34.1137794,-118.6609214,0,,LOS ANGELES,Unincorp LA
335,82,Dry Canyon Cold Creek Rd,,Dry Canyon Cold Creek Road,Jessica/Jill,4/4/2003,entered by NK 09/03/03,,DL,DL,DL,DL,,,,,,NA,NA,,No,No,No,0,0,0,0,NA,NA,No,NA,No,No,No,No,XX,XX,XX,XX,No,No,No,No,No,development road,Outside,0,34.11393801,-118.6623614,0,,LOS ANGELES,Unincorp LA
336,54,Circle X Ranch Ranger Station,Circle X Ranch,Yerba Buena ^ Circle X Ranch Ranger Station,Jessica/Jill,3/17/2003,mb12/31/03 entered by NK 09/10/0,NPS,OP,OP,OP,OP,HO,HO,HO,,,Secondary,Secondary,,Yes,Yes,Yes,888,0,0,0,parking lot,paved,Yes,flush,Yes,No,No,Yes,Yes,Yes,Yes,No,No,Yes,No,Yes,No,"Group campground, Grotto trailhead, recycling, no trail access to north as aerial shows.",Outside,2,34.10994094,-118.9372191,0,Y,VENTURA,Unincorp Ventura
337,10,Peter Strauss East,Peter Strauss Ranch,Eastern edge of PS Ranch at Mulholland,MB,,mb12/30/03,,UP,UP,UP,UP,UN,HE,UN,,,Unauthorized,Unauthorized,Yes,Yes,No,Yes,888,888,888,888,on-street,dirt,No,NA,No,No,No,No,XX,XX,XX,XX,No,No,No,No,No,"12/30/03 Neighborhood entrance, but general public could park on Mulholland & enter.  Involves unofficial trails on Vintage property to get to Peter Strauss Loop Trail.",Coastal,0,34.11247159,-118.7728369,0,,LOS ANGELES,Unincorp LA
338,67,Reagan Ranch,Malibu Creek State Park,SE Corner Mulholland ^ Cornell,MB,,mb01/01/04,CDPR,OP,OP,OP,OP,HE,HE,HE,,,Tertiary,Tertiary,,Yes,Yes,Yes,888,0,1,0,parking lot,gravel,Yes,chemical,No,No,No,No,No,XX,XX,No,No,No,No,No,No,Updated 07/27/08. In-house review.  Facilities inventory not completed.  Planned equestrian camp.  10/7/09 MB Mike Malone confirmed eq pkg takes place.,Outside,0,34.11280952,-118.750748,0,N,LOS ANGELES,Unincorp LA
339,82,Beacontree Lane,,Beacontree Lane,Jessica/Jill,4/4/2003,entered by NK 09/03/03,,DL,DL,DL,DL,,,,,,NA,NA,,No,No,No,0,0,0,0,NA,NA,No,NA,No,No,No,No,XX,XX,XX,XX,No,No,No,No,No,development road,Outside,0,34.11412914,-118.6630634,0,,LOS ANGELES,Unincorp LA
340,79,Chamera Lane,,Chamera Lane,Jessica/Jill,4/7/2003,mb12/07/03 entered by NK 09/03/0,,UX,UX,UX,UX,,,,,,NA,NA,,Yes,No,No,0,0,0,0,NA,NA,No,NA,No,No,No,No,XX,XX,XX,XX,No,No,No,No,No,May become a UP if Summit-to-Summit properties are acquired.,Outside,0,34.11484596,-118.6215783,0,,LOS ANGELES,Unincorp LA
341,67,Paramount Ranch/Mulholland Hwy,Paramount Ranch,Paramount Ranch/Mulholland Hwy,MB,,mb01/01/04,NPS,OP,OP,OP,OP,HE,HE,HE,,,Tertiary,Tertiary,,Yes,Maybe,No,0,0,0,0,NA,NA,No,NA,No,No,No,No,XX,XX,XX,XX,No,No,No,No,No,In-house review.  Mainly used as legitimate connecting access point between MCSP & Paramount.,Outside,0,34.11314552,-118.7514996,0,Y,LOS ANGELES,Unincorp LA
342,81,Henry Ridge Mtwy,,Henry Ridge Motorway,Jessica/Jill,4/21/2003,mb12/07/03 entered by NK 09/03/0,OTH-PRIVATE,DL,DL,DL,DL,,,,,,NA,NA,,No,No,No,0,0,0,0,NA,NA,No,NA,No,No,No,No,XX,XX,XX,XX,No,No,No,No,No,,Outside,0,34.11506328,-118.6131386,0,,LOS ANGELES,Unincorp LA
343,81,Will Geer Rd/Mesa Dr,,Will Greer Road (Mesa Drive),,,mb01/02/04,OTH-PRIVATE,DL,DL,DL,DL,,,,,,NA,NA,,No,No,No,0,0,0,0,NA,NA,No,NA,No,No,No,No,XX,XX,XX,XX,No,No,No,No,No,,Outside,0,34.11533871,-118.5987982,0,,LOS ANGELES,Unincorp LA
344,81,Greenleaf Cyn Rd,,Greenleaf Canyon Road,Jessica/Jill,4/4/2003,mb12/07/03 entered by NK 09/03/0,OTH-PRIVATE,DL,DL,DL,DL,,,,,,NA,NA,,No,No,No,0,0,0,0,NA,NA,No,NA,No,No,No,No,XX,XX,XX,XX,No,No,No,No,No,,Outside,0,34.11537645,-118.6085117,0,,LOS ANGELES,Unincorp LA
345,78,Zuniga Rd,,Zuniga Road,Jessica/Jill,4/7/2003,mb01/02/04 entered by NK 09/03/0,,UX,UX,UX,UX,,,,,,NA,NA,,Yes,No,No,0,0,0,0,NA,NA,No,NA,No,No,No,No,XX,XX,XX,XX,No,No,No,No,No,,Outside,0,34.1151812,-118.6413316,0,,LOS ANGELES,Unincorp LA
346,92,Runyon Cyn Desmond Estates Rd,Runyon Canyon Park,Lisco Place,AP/MB/EE,6/21/2000,mb11/01/00,CTY-LA,DL,DL,DL,DL,,,,,,NA,NA,,No,No,No,0,0,0,0,NA,NA,No,NA,No,No,No,No,XX,XX,XX,XX,No,No,No,No,No,"""no trespassing"" posted.  Could conceivably connect into Runyon Cyn Park.",Outside,0,34.1188147,-118.3539237,0,,LOS ANGELES,Los Angeles
347,92,Runyon Cyn Trailhead North,Runyon Canyon Park,Runyon Canyon Road ^ Mulholland Dr,AP/MB/EE,6/21/2000,mb11/01/00,LA CITY,OP,OP,OP,OP,HO,HO,HO,,,Secondary,Secondary,,Yes,Yes,Yes,40,0,0,0,parking lot,dirt,No,NA,No,No,No,No,No,XX,XX,XX,No,No,No,No,No,"Odd signage:  an official TH w/no trespassing posted, and ""your taxpayer dollars at work.""  Also accesses off-leash dog areas. Heavily used TH.  10/9/09 MB BingMaps pkg spc count by cars present indics 40 spaces.",Outside,2,34.11900412,-118.3528967,0,Y,LOS ANGELES,Los Angeles
348,92,Runyon Cyn Hillpark Dr,?,Mulholland ^ Hillpark,Andrew,3/14/2000,mb06/09/00,OTH-PRIVATE,DL,DL,DL,DL,,,,,,NA,NA,,No,No,No,0,0,0,0,NA,NA,No,NA,No,No,No,No,XX,XX,XX,XX,No,No,No,No,No,just the end of street that pseudo-connects to Mulholland.  Street connects of unofficial trail near Hollywood Bowl.,Outside,0,34.11915754,-118.3438535,0,,LOS ANGELES,Los Angeles
349,81,Luse Tank Rd,,Luse Tank Road,Jessica/Jill,4/4/2003,mb12/07/03 entered by NK 09/03/0,OTH-PRIVATE,DL,DL,DL,DL,,,,,,NA,NA,,No,No,No,0,0,0,0,NA,NA,No,NA,No,No,No,No,XX,XX,XX,XX,No,No,No,No,No,,Outside,0,34.11607591,-118.605019,0,,LOS ANGELES,Unincorp LA
350,78,Topanga/Old Topanga Cyn Rd,,Old Topanga Canyon Road,Jessica/Jill,4/7/2003,entered by NK 09/03/03,,DL,DL,DL,DL,,,,,,NA,NA,,No,No,No,0,0,0,0,NA,NA,No,NA,No,No,No,No,XX,XX,XX,XX,No,No,No,No,No,,Outside,0,34.11579994,-118.6334752,0,,LOS ANGELES,Unincorp LA
351,55,BBT - Sandstone Peak Trailhead,Circle X Ranch,Yerba Buena ^ Sandstone Peak TH,Jessica/Jill,3/17/2003,mb12/31/03 entered by NK,NPS,OP,OP,OP,OP,MU,HO,,,,Tertiary,Tertiary,,Yes,Yes,Yes,30,0,0,0,parking lot,gravel,Proposed,composting,No,Yes,No,No,No,Yes,Yes,No,No,Yes,No,No,No,maintenance needed to access of parking lot.  TMP Team rec's:  harden parking surface,in,2,34.11167921,-118.9266962,0,Y,VENTURA,Unincorp Ventura
352,100,Peter Strauss Ranch,Peter Strauss Ranch,Mulholland ^ Troutdale,Jim Anderson,3.27.01,mb01/01/04,NPS,OP,OP,OP,OP,HE,HE,HE,,,Secondary,Secondary,,Yes,Yes,Yes,25,0,1,1,parking lot,dirt,Yes,flush,No,Yes,No,Yes,Yes,Yes,Yes,Proposed,No,Yes,No,No,No,"Trailhead infrastructure associated with ranch location, removed from TH. Childrens playground.  Proposed shuttle stop.  TH handles parking for events at ranch.",Outside,1,34.11393322,-118.7783663,0,Y,LOS ANGELES,Unincorp LA
353,81,Greenleaf Cyn Rd,,Greenleaf Canyon Road,Jessica/Jill,4/4/2003,mb12/07/03 entered by NK 09/03/0,OTH-PRIVATE,DL,DL,DL,DL,,,,,,NA,NA,,No,No,No,0,0,0,0,NA,NA,No,NA,No,No,No,No,XX,XX,XX,XX,No,No,No,No,No,,Outside,0,34.11630121,-118.6070985,0,,LOS ANGELES,Unincorp LA
354,92,Runyon Cyn Mulholland East Edge,?,Mulholland Drive,Andrew,3/14/2000,mb11/01/00,OTH-PRIVATE,DL,DL,DL,DL,,,,,,NA,NA,,No,No,No,0,0,0,0,NA,NA,No,NA,No,No,No,No,XX,XX,XX,XX,No,No,No,No,No,,Outside,0,34.11970336,-118.3436246,0,,LOS ANGELES,Los Angeles
355,80,Topanga/Paradise Ln,NPS & TSP,Paradise Lane,MB - in office,5/27/2001,mb01/02/04 mb05/27/01,private,UP,EM,EM,EM,,HE,,,,Unauthorized,Tertiary,,Yes,No,Yes,1,0,0,0,pullout,dirt,No,NA,No,No,No,No,XX,XX,XX,XX,No,No,No,No,No,"No field check needed.  May be ""No Trespassing"" signs present.  Currently neighborhood entrance, but may become official if Santa Maria Cyn missing link is realized.",Outside,0,34.11768372,-118.5750335,0,,LOS ANGELES,Unincorp LA
356,92,Runyon Cyn Pacific View Dr,?,Pacific View Drive,Andrew,3/14/2000,mb06/09/00,OTH-PRIVATE,DL,DL,DL,DL,,,,,,NA,NA,,No,No,No,0,0,0,0,NA,NA,No,NA,No,No,No,No,XX,XX,XX,XX,No,No,No,No,No,"22 obviously connects to 21, but can't find 22 trailhead -- behind some houses.",Outside,0,34.12043668,-118.3458316,0,,LOS ANGELES,Los Angeles
357,80,Aft Trail Road,Ed Edelman,terminus of Aft Trail Road,MB - in office,5/28/2001,mb01/02/04 mb05/28/01,private,UP,UP,UP,UP,,,,,,Unauthorized,Unauthorized,Yes,Y,Maybe,No,0,0,0,0,NA,NA,No,NA,No,No,No,No,XX,XX,XX,XX,No,No,No,No,No,"No field ck done.  Neighborhood entrance to state parkland.  ignore, close, SUP?",Outside,0,34.11762275,-118.5877112,0,,LOS ANGELES,Unincorp LA
358,0,Franklin Cyn Dr ^ Sycamore Meadow,Franklin Canyon,,MB/EE,6/21/2000,mb10/31/00,MRCA,OP,OP,OP,OP,HO,HO,,,,Tertiary,Tertiary,,Yes,No,Yes,4,0,0,0,pullout,paved,No,NA,No,No,No,No,No,XX,XX,XX,No,No,No,No,XX,,out,0,34.12006596,-118.4088519,0,Y,LOS ANGELES,Los Angeles
359,67,Paramount Ranch Main Entrance,Paramount Ranch,Paramount Ranch Main Entrance,MB,,mb01/01/04 mb12/17/02,NPS,OP,OP,OP,OP,MU,HE,,,,Primary,Primary,,Yes,Yes,Yes,100,999,1,999,parking lot,dirt,Yes,flush,Yes,Yes,Yes,Yes,Yes,Yes,Yes,XX,No,Yes,No,No,No,In-hse review.  Proposed shuttle stop.  Disorganized layout for a primary TH.,Outside,1,34.1157198,-118.7553023,0,Y,LOS ANGELES,Unincorp LA
360,80,Clear Trail Road,Ed Edelman Park,terminus of Clear Trail Road,MB - in office,5/28/2001,mb01/02/04 mb05/28/01,private,UP,UP,UP,UP,,,,,,Unauthorized,Unauthorized,Yes,Yes,Maybe,Maybe,0,0,0,0,,,No,NA,No,No,No,No,XX,XX,XX,XX,No,No,No,No,No,"No field ck done.  Neighborhood entrance to state parkland.  ignore, close, SUP?",Outside,0,34.11808257,-118.5890638,0,,LOS ANGELES,Unincorp LA
361,57,"Kanan Rd pullout, outside of N",,Kanan Road,Jessica/Jill,4/7/2003,entered by NK  09/10/03,,DL,DL,DL,DL,,,,,,NA,NA,,No,No,No,0,0,0,0,NA,NA,No,NA,No,No,No,No,XX,XX,XX,XX,No,No,No,No,No,,Outside,0,34.11521455,-118.8032728,0,,LOS ANGELES,Unincorp LA
362,78,Topanga/Burson Rd/Portage Circle Dr,,Burson Road & Portage Circle Dr,Jessica/Jill,4/7/2003,mb12/07/03 entered by NK 09/03/0,OTH-PRIVATE,DL,DL,DL,DL,,,,,,NA,NA,,,No,No,0,0,0,0,NA,NA,No,NA,No,No,No,No,XX,XX,XX,XX,No,No,No,No,No,,Outside,0,34.11774872,-118.6245609,0,,LOS ANGELES,Unincorp LA
363,80,Topanga/Rubicon Rd,,Rubicon Road,Jessica,4/4/2003,mb12/07/03 entered by NK 09/03/0,OTH-PRIVATE,DL,DL,DL,DL,,,,,,NA,NA,,No,No,No,0,0,0,0,NA,NA,No,NA,No,No,No,No,XX,XX,XX,XX,No,No,No,No,No,,Outside,0,34.11820398,-118.5935974,0,,LOS ANGELES,Unincorp LA
364,0,WODOC Nature Trail / Rowen Trail,Franklin Canyon,Heavenly Pond,MB/EE,6/21/2000,mb10/31/00,MRCA,OP,OP,OP,OP,HO,,,,,Tertiary,Tertiary,,Yes,Yes,Yes,2,0,0,0,pullout,paved,Yes,flush,No,Yes,No,Yes,No,Yes,XX,XX,No,No,No,No,XX,Parking for universal access trail,out,0,34.12063179,-118.4107764,0,Y,LOS ANGELES,Los Angeles
365,78,Hodgson Circle Rd,,Hodgson Circle Road,Jessica/Jill,4/7/2003,entered by NK 09/03/03,,XX,XX,,,,,,,,XX,XX,,Yes,No,No,0,0,0,0,NA,NA,No,NA,No,No,No,No,XX,XX,XX,XX,No,No,No,No,No,,Outside,0,34.11807525,-118.6320688,0,,LOS ANGELES,Unincorp LA
366,56,Westlake Blvd,,"Westlake Boulevard, north of Mulholland Hwy",Jessica/Jill,4/7/2003,entered by NK  09/10/03,,DL,DL,DL,DL,,,,,,NA,NA,,No,No,No,0,0,0,0,NA,NA,No,NA,No,No,No,No,XX,XX,XX,XX,No,No,No,No,No,development road,Outside,0,34.11499166,-118.8532515,0,,LOS ANGELES,Unincorp LA
367,78,Portage Cir,,Portage Circle Dirve,Jessica/Jill,4/7/2003,mb12/07/03 entered by NK 09/03/0,OTH-PRIVATE,DL,DL,DL,DL,,,,,,NA,NA,,No,No,No,0,0,0,0,NA,NA,No,NA,No,No,No,No,XX,XX,XX,XX,No,No,No,No,No,,Outside,0,34.11825181,-118.6240216,0,,LOS ANGELES,Unincorp LA
368,78,Portage Cir,,Portage Circle Drive,Jessica/Jill,4/7/2003,mb12/07/03 entered by NK 09/03/0,OTH-PRIVATE,UX,UX,UX,UX,,,,,,NA,NA,,Yes,No,No,0,0,0,0,NA,NA,No,NA,No,No,No,No,XX,XX,XX,XX,No,No,No,No,No,May become a UP if Summit-to-Summit properties are acquired.,Outside,0,34.11823004,-118.6256668,0,,LOS ANGELES,Unincorp LA
369,0,Redwood Grove,Franklin Canyon,Franklin Canyon Lake,MB/EE,6/21/2000,mb10/31/00,MRCA,OP,OP,OP,OP,HO,,,,,Tertiary,Tertiary,,Yes,No,Yes,40,0,0,0,parking lot,dirt,No,NA,No,No,No,No,No,XX,XX,XX,No,No,No,No,XX,Just a big parking area.,out,0,34.12094469,-118.4105245,0,Y,LOS ANGELES,Los Angeles
370,54,BBT - Mishe Mokwa Trailhead S,Circle X Ranch,BBT ^ Yerba Buena Rd,MB,,mb12/31/03 mb11/04/02,NPS,OP,OP,OP,OP,MU,MU,MU,,,Secondary,Secondary,,Yes,Yes,Yes,15,0,99,0,parking lot,dirt,Proposed,composting,No,Proposed,No,No,No,Proposed,Proposed,No,No,No,No,No,No,TMP Rec's:  Enlarge parking area.  Place restroom at S end of area.  Install 2-panel bulletin board.  Harden parking surface to protect arch resources.,,2,34.11418396,-118.9183345,0,Y,VENTURA,Unincorp Ventura
371,83,Stokes Cyn Rd at Headstorm Cyn Rd,,Stokes Canyon at Headstorm Canyon,Jessica/Jill,4/7/2003,mb01/02/04 entered by NK 09/03/0,,UX,UP,UP,UP,,HE,,,,NA,Unauthorized,,Maybe,No,No,0,0,0,0,NA,NA,No,NA,No,No,No,No,XX,XX,XX,XX,No,No,No,No,No,"Would be likely unofficial connection to parkland to north & Cold Creek Trail system.  ignore, close, SUP if the time comes?",Outside,0,34.11796786,-118.6781774,0,,LOS ANGELES,Unincorp LA
372,55,BBT - Mishe Mokwa Trailhead N,Circle X Ranch,"Yerba Buena Rd ^ BBT-Mishe Mokwa Trail, N side of road",MB,,mb12/31/03,NPS,UP,EC,EC,EC,HO,HO,,,,Tertiary,NA,,Yes,Yes,Yes,5,0,0,0,pullout,dirt,No,NA,No,No,No,No,No,No,No,No,No,No,No,No,No,TMP Team:  Close this parking area and create better trailhead across Yerba Buena.,Outside,0,34.11450161,-118.9181947,0,,VENTURA,Unincorp Ventura
373,80,Topanga/Topanga Cyn Blvd,,Topanga Canyon Boulevard,Jessica,4/4/2003,mb12/07/03 entered by NK 09/03/0,OTH-PRIVATE,DL,DL,DL,DL,,,,,,NA,NA,,Yes,No,Yes,888,888,888,888,pullout,dirt,No,NA,No,No,No,No,XX,XX,XX,XX,No,No,No,No,No,mb edits,Outside,0,34.11918289,-118.5918277,0,,LOS ANGELES,Unincorp LA
374,79,Halsey Rd,,Halsey Road,Jessica/Jill,4/7/2003,mb01/02/04 entered by NK 09/03/0,,DL,DL,DL,DL,,,,,,NA,NA,,Yes,No,No,0,0,0,0,NA,NA,No,NA,No,No,No,No,XX,XX,XX,XX,No,No,No,No,No,,Outside,0,34.11869262,-118.6292072,0,,LOS ANGELES,Unincorp LA
375,68,Redkin Devt Entrance,,Terminus of Triunfo Dr.,MB,,mb12/30/03,,UP,UP,UP,UP,UN,HO,UN,,,Unauthorized,Unauthorized,Yes,No,No,Yes,888,888,888,888,on-street,paved,No,NA,No,No,No,No,XX,XX,XX,XX,No,No,No,No,No,"12/30/03 - In-hse review.  Redkin devt is not gated, but this would be used primarily by immediate neighborhood.  Close?",Outside,0,34.11684999,-118.773789,0,,LOS ANGELES,Unincorp LA
376,93,Barbara Fine Summit Overlook,Mulholland Scenic Parkway,11801 Mulholland Drive,MB/EE,6/21/2000,mb10/31/00,MRCA,OP,OP,OP,OP,NA,,,,,Overlook Only,Overlook Only,,No,No,Yes,4,0,0,1,pullout,paved,No,NA,No,No,No,No,No,No,No,No,Official,No,No,No,No,,out,0,34.12178977,-118.398395,0,,LOS ANGELES,Los Angeles
377,81,Henry Ridge Motorway,,Henry Ridge Motorway,Jessica/Jill,,mb12/07/03 entered by NK 09/03/0,OTH-PRIVATE,DL,DL,DL,DL,,,,,,NA,NA,,No,No,No,0,0,0,0,NA,NA,No,NA,No,No,No,No,XX,XX,XX,XX,No,No,No,No,No,,Outside,0,34.11931362,-118.6134162,0,,LOS ANGELES,Unincorp LA
378,93,Nancy Hoover Pohl Overlook,Fryman Canyon/Mulholland Scenic Parkway,8401 Mulholland Drive,Kerry/Andrew,3/14/2000,mb06/10/00,MRCA,OP,OP,OP,OP,HO,HO,,,,Tertiary,Tertiary,,Yes,Yes,Yes,19,0,0,1,parking lot,paved,No,NA,No,No,Yes,Yes,No,Yes,No,Yes,Official,No,No,No,No,10/14/09 MB - Visited site & confirmed facilities.  No picnic tables.  Benches.  Some exercise structures.,Outside,2,34.12214348,-118.3848616,0,Y,LOS ANGELES,Los Angeles
379,93,"Fryman Canyon -- Mulholland, east pullout",Fryman Canyon Park,Mulholland ^ Laurel Pass,Andrew,3/14/2000,mb06/10/00,NPS,UP,UP,UP,UP,,,,,,Unauthorized,Unauthorized,,No,No,No,0,0,0,0,NA,NA,No,NA,No,No,No,No,XX,XX,XX,XX,No,No,No,No,No,"Looks like OP path w.exercise equipment, but no signs.  Basically same trailhead as #4, just another on-street access point",Outside,0,34.12230003,-118.3832527,0,,LOS ANGELES,Los Angeles
380,78,Old Topanga Cyn Rd,,Old Topanga Canyon Road,Jessica/Jill,4/7/2003,mb01/02/04 entered by NK 09/03/0,,DL,DL,DL,DL,,,,,,NA,NA,,No,No,No,0,0,0,0,NA,NA,No,NA,No,No,No,No,XX,XX,XX,XX,No,No,No,No,No,mb edits,Outside,0,34.11959103,-118.6338703,0,,LOS ANGELES,Unincorp LA
381,89,Mandeville^Garden Land Rd.,Westridge-Canyonback Wilderness Park,Mandeville^Garden Land Rd.,MB/EE,8/4/2000,mb10/31/00,MRCA,OP,OP,OP,OP,MU,,,,,Tertiary,Tertiary,,Yes,No,Yes,1,0,0,0,on-street,paved,No,NA,No,No,No,No,No,No,No,No,No,No,No,No,No,Private neighborhood area.  mb12/10/08 - Use designation confirmed by MRCA Jewel Johnson,Outside,0,34.12127013,-118.5066892,0,Y,LOS ANGELES,Los Angeles
382,83,Stokes Canyon / Headstorm Canyon Road,,Stokes Canyon / Headstorm Canyon Road,Jessica/Jill,4/7/2003,mb01/01/04 entered by NK 09/03/0,,UX,UP,UP,UP,,HE,,,,NA,Unauthorized,,Maybe,No,No,0,0,0,0,NA,NA,No,NA,No,No,No,No,XX,XX,XX,XX,No,No,No,No,No,mb edits.  Assigned UP proposal because hope some agency acquires parkland in area.,Outside,0,34.11912708,-118.6750046,0,,LOS ANGELES,Calabasas
383,0,Blinderman Trailhead,Franklin Canyon,WODOC,MB/EE,6/21/2000,mb10/31/00,MRCA,OP,OP,OP,OP,HO,HO,,,,Secondary,Secondary,,Yes,Yes,Yes,10,0,0,1,parking lot,gravel,Yes,flush,Yes,Yes,No,Yes,Yes,Yes,XX,Proposed,No,Yes,No,No,XX,Uses same facilities as WODOC parking lot.,out,0,34.12252021,-118.4083013,0,Y,LOS ANGELES,Los Angeles
384,80,Topanga/Topanga Cyn Blvd,,Topanga Canyon Boulevard,Jessica,4/4/2003,mb12/07/03 entered by NK 09/03/0,OTH-PRIVATE,UX,UX,UX,UX,,,,,,NA,NA,,Yes,No,Yes,888,888,888,888,pullout,dirt,No,NA,No,No,No,No,XX,XX,XX,XX,No,No,No,No,No,,in,0,34.12069803,-118.591386,0,,LOS ANGELES,Unincorp LA
385,93,Autry Overlook,Fryman Canyon Park - Adj,8601 Mulholland Drive,Kerry,,mb11/01/00,MRCA,OP,OP,OP,OP,NA,,,,,Overlook Only,Overlook Only,,No,No,Yes,888,0,0,0,pullout,dirt,No,NA,No,No,No,No,No,No,No,No,Official,No,No,No,No,#6 is larger than #5.  Neither point is very nice.  #6 has curb to bump your car over to get to it.,Outside,0,34.12334692,-118.3891692,0,,LOS ANGELES,Los Angeles
386,81,Henry Ridge Motorway,,Henry Ridge Motorway,Jessica/Jill,,mb12/07/03 entered by NK 09/03/0,OTH-PRIVATE,DL,DL,DL,DL,,,,,,NA,NA,,No,No,No,0,0,0,0,NA,NA,No,NA,No,No,No,No,XX,XX,XX,XX,No,No,No,No,No,,Outside,0,34.12062684,-118.6131549,0,,LOS ANGELES,Unincorp LA
387,93,Dead Man Overlook,Fryman Canyon Park,8591 Mulholland Drive,Kerry/Andrew,,mb6/20/00,MRCA,OP,OP,OP,OP,NA,,,,,Overlook Only,Overlook Only,,No,No,Yes,888,0,0,0,pullout,dirt,No,NA,No,No,No,No,No,No,No,No,Official,No,No,No,No,"Trail exists that connects to Dearing Trail, but is steep, eroding & unsanctioned.",Outside,0,34.12365065,-118.3874287,0,,LOS ANGELES,Los Angeles
388,0,WODOC parking lot,Franklin Canyon,Upper Franklin Canyon ^ Franklin Cyn Drive,MB/EE,6/21/2000,mb10/31/00,MRCA,OP,OP,OP,OP,HO,HO,,,,Primary,Primary,,Yes,No,Yes,75,0,0,2,parking lot,gravel,Yes,flush,Yes,Yes,No,Yes,Yes,Yes,XX,Proposed,No,Yes,No,No,No,main parking for Sooky Goldman Nature Center,out,2,34.12357044,-118.4091044,0,Y,LOS ANGELES,Los Angeles
389,0,Berman Trail pullout,Franklin Canyon,Franklin Canyon ^ Dam,MB/EE,6/21/2000,mb10/31/00,MRCA,OP,OP,OP,OP,HO,HO,,,,Tertiary,Tertiary,,Yes,No,Yes,3,0,0,0,pullout,dirt,No,NA,No,No,No,No,No,XX,XX,XX,No,No,No,No,XX,,out,0,34.12381024,-118.409531,0,Y,LOS ANGELES,Los Angeles
390,93,Fryman Canyon -- Mulholland Terrace,Fryman Canyon Park,Laurel Canyon Boulevard,Kerry/Andrew,3/14/2000,mb06/10/00,,UP,UP,UP,UP,,,,,,Unauthorized,Unauthorized,,Yes,No,No,0,0,0,0,NA,NA,No,NA,No,No,No,No,XX,XX,XX,XX,No,No,No,No,No,"Unofficial park entrance for residents on N side of Mulholland Hwy in this vicinity.  Ignore, close, SUP?",Outside,0,34.12424321,-118.3768465,0,,LOS ANGELES,Los Angeles
